{
  "name": "guide_user_pan_zoom",
  "fixture": "still_object_table",
  "fakeClock": true,
  "stepPerFrame": 0.25,
  "subject0": { "nx": 0.62, "ny": 0.55 },
  "send": {
    "op": "guideUser",
    "id": "2",
    "body": {
      "panNx": -0.12,
      "panNy": -0.08,
      "zoomRatio": 1.8,
      "followSuggested": true
    }
  },
  "nFrameWindow": 4,
  "expectSubjectTrajectory": [
    { "frame": 0, "nx": 0.62, "ny": 0.55 },
    { "frame": 1, "nx": 0.59, "ny": 0.53 },
    { "frame": 2, "nx": 0.56, "ny": 0.51 },
    { "frame": 3, "nx": 0.53, "ny": 0.49 },
    { "frame": 4, "nx": 0.5, "ny": 0.47 }
  ],
  "expectFrame": { "zoomRatio": 1.8 }
}
