{
  "name": "capture_apply_crop",
  "fixture": "still_object_table",
  "fakeClock": true,
  "steps": [
    {
      "send": {
        "op": "openSession",
        "id": "1",
        "body": {
          "facing": "back",
          "profileId": "xiaomi.15s_pro.hyperos2",
          "previewMaxFps": 30,
          "previewMaxWidth": 1920,
          "sessionProfile": "still",
          "aiGuide": "off"
        }
      },
      "expectSession": {
        "sessionProfile": "still"
      }
    },
    {
      "send": { "op": "captureStill", "id": "2" },
      "expectStill": {
        "width": 4096,
        "height": 3072,
        "appliedLutId": null,
        "activeLensId": "physical_main"
      }
    },
    {
      "send": {
        "op": "applyCrop",
        "id": "3",
        "body": {
          "sourceUri": "content://com.autocam.app.fileprovider/stills/20260911_001.jpg",
          "cropBoxNorm": { "x0": 0.06, "y0": 0.04, "x1": 0.94, "y1": 0.9 },
          "rotationDeg": -1.8,
          "lutId": "lut.warm_v1",
          "bakeLut": false
        }
      },
      "expectStill": { "appliedLutId": null }
    },
    {
      "send": {
        "op": "applyCrop",
        "id": "4",
        "body": {
          "sourceUri": "content://com.autocam.app.fileprovider/stills/20260911_001.jpg",
          "cropBoxNorm": { "x0": 0.06, "y0": 0.04, "x1": 0.94, "y1": 0.9 },
          "rotationDeg": -1.8,
          "lutId": "lut.warm_v1",
          "bakeLut": true
        }
      },
      "expectStill": { "appliedLutId": "lut.warm_v1" }
    }
  ]
}
